{"$id":"https://harness.planeon.ai/schemas/v1alpha1/runtime/runtime-admission-receipt.schema.json","$schema":"https://json-schema.org/draft/2020-12/schema","additionalProperties":false,"properties":{"apiVersion":{"$ref":"common.schema.json#/$defs/apiVersion"},"kind":{"const":"RuntimeAdmissionReceipt"},"metadata":{"$ref":"common.schema.json#/$defs/metadata"},"payload":{"additionalProperties":false,"allOf":[{"else":{"properties":{"reasonCode":{"$ref":"common.schema.json#/$defs/denialReason"}}},"if":{"properties":{"decision":{"const":"ADMIT"}},"required":["decision"]},"then":{"properties":{"budgetConsumptionDigest":{"$ref":"common.schema.json#/$defs/sha256"},"reasonCode":{"type":"null"},"replayRecordDigest":{"$ref":"common.schema.json#/$defs/sha256"}}}}],"properties":{"admissionDigest":{"$ref":"common.schema.json#/$defs/sha256"},"budgetConsumptionDigest":{"oneOf":[{"type":"null"},{"$ref":"common.schema.json#/$defs/sha256"}]},"decidedAt":{"$ref":"common.schema.json#/$defs/timestamp"},"decision":{"enum":["ADMIT","DENY"]},"expiresAt":{"$ref":"common.schema.json#/$defs/timestamp"},"organizationId":{"$ref":"common.schema.json#/$defs/stableId"},"reasonCode":{"oneOf":[{"type":"null"},{"$ref":"common.schema.json#/$defs/denialReason"}]},"receiptId":{"$ref":"common.schema.json#/$defs/stableId"},"replayRecordDigest":{"oneOf":[{"type":"null"},{"$ref":"common.schema.json#/$defs/sha256"}]},"requestDigest":{"$ref":"common.schema.json#/$defs/sha256"},"trustBundleDigest":{"$ref":"common.schema.json#/$defs/sha256"}},"required":["organizationId","receiptId","admissionDigest","requestDigest","trustBundleDigest","decision","reasonCode","budgetConsumptionDigest","replayRecordDigest","decidedAt","expiresAt"],"type":"object"},"signature":{"allOf":[{"$ref":"common.schema.json#/$defs/signature"},{"properties":{"purpose":{"const":"RUNTIME_RECEIPT"}}}]}},"required":["apiVersion","kind","metadata","payload","signature"],"title":"RuntimeAdmissionReceipt","type":"object"}
